[
  {"source_id":"src-ai-picture-industry","title":"AI 画质行业与技术变化证据","source_type":"external_primary","locator":{"uri":"TBD","page":null,"section":null,"accessed_at":null},"status":"needed","publisher":null,"published_at":null,"scope":"目标市场、2024-2026","supports":["Why Now","行业变化"],"limitations":["尚未研究"],"license_or_usage":null,"content_hash":null},
  {"source_id":"src-ai-picture-user","title":"目标用户画质调节研究","source_type":"interview","locator":{"uri":"TBD","page":null,"section":null,"accessed_at":null},"status":"needed","publisher":null,"published_at":null,"scope":"目标用户、关键观影场景","supports":["用户行为","痛点","需求与动机"],"limitations":["样本和方法待定义"],"license_or_usage":null,"content_hash":null},
  {"source_id":"src-ai-picture-usage","title":"画质设置路径与应用行为数据","source_type":"dataset","locator":{"uri":"TBD","page":null,"section":null,"accessed_at":null},"status":"needed","publisher":null,"published_at":null,"scope":"入口曝光、进入、调节、保存、撤回","supports":["行为漏斗","主要障碍"],"limitations":["埋点可用性未知"],"license_or_usage":null,"content_hash":null},
  {"source_id":"src-ai-picture-competitor","title":"竞品 AI 画质能力与交互实测","source_type":"observation","locator":{"uri":"TBD","page":null,"section":null,"accessed_at":null},"status":"needed","publisher":null,"published_at":null,"scope":"至少三家可比电视产品","supports":["竞品方向","交互差异","未解决问题"],"limitations":["机型、地区和版本待确认"],"license_or_usage":null,"content_hash":null},
  {"source_id":"src-ai-picture-current-state","title":"内部 AI 画质能力盘点","source_type":"internal_document","locator":{"uri":"TBD","page":null,"section":null,"accessed_at":null},"status":"needed","publisher":null,"published_at":null,"scope":"算法、端侧、云端、设置与信源","supports":["Current State","Gap","依赖"],"limitations":["需跨团队确认"],"license_or_usage":"internal","content_hash":null},
  {"source_id":"src-ai-picture-business","title":"AI Picture 业务目标与目标机型","source_type":"internal_document","locator":{"uri":"TBD","page":null,"section":null,"accessed_at":null},"status":"needed","publisher":null,"published_at":null,"scope":"目标市场、机型、时间窗","supports":["产品定位","Roadmap","Business Metrics"],"limitations":["尚未确认"],"license_or_usage":"internal","content_hash":null}
]
